{
  "_generated": true,
  "generator": "gen_model_benchmarks.py",
  "generated_at": "2026-06-28T05:38:45Z",
  "schema_version": "1.0.0",
  "benchmark": {
    "date": "2026-06-26",
    "gpu": "RTX 3090 24GB",
    "sample_items": 27,
    "num_ctx": 16384,
    "reference": "ref=cmp-oct2-codex"
  },
  "models": {
    "claude:claude": {
      "n_items": 27,
      "completed": 27,
      "completion_pct": 100.0,
      "depth_on_success_pct": 98.0,
      "schema_valid_pct": 100.0,
      "accuracy_pct": 59.0,
      "goal_pct": 100.0,
      "objectives_pct": 95.0,
      "requirements_pct": 99.0,
      "archetype_fields_pct": 99.0,
      "sec_per_item": 24.5,
      "gen_tok_s": 34.0,
      "usd_per_1k_items": 0.0
    },
    "codex:codex": {
      "n_items": 27,
      "completed": 27,
      "completion_pct": 100.0,
      "depth_on_success_pct": 99.0,
      "schema_valid_pct": 100.0,
      "accuracy_pct": 100.0,
      "goal_pct": 100.0,
      "objectives_pct": 96.0,
      "requirements_pct": 100.0,
      "archetype_fields_pct": 99.0,
      "sec_per_item": 15.2,
      "gen_tok_s": 49.3,
      "usd_per_1k_items": 0.0
    },
    "cursor:composer-2.5": {
      "n_items": 27,
      "completed": 27,
      "completion_pct": 100.0,
      "depth_on_success_pct": 99.0,
      "schema_valid_pct": 100.0,
      "accuracy_pct": 81.0,
      "goal_pct": 100.0,
      "objectives_pct": 96.0,
      "requirements_pct": 99.0,
      "archetype_fields_pct": 100.0,
      "sec_per_item": 18.7,
      "gen_tok_s": 46.0,
      "usd_per_1k_items": 32.1459
    },
    "cursor:composer-2.5-fast": {
      "n_items": 27,
      "completed": 27,
      "completion_pct": 100.0,
      "depth_on_success_pct": 98.0,
      "schema_valid_pct": 100.0,
      "accuracy_pct": 81.0,
      "goal_pct": 100.0,
      "objectives_pct": 95.0,
      "requirements_pct": 99.0,
      "archetype_fields_pct": 100.0,
      "sec_per_item": 12.7,
      "gen_tok_s": 64.4,
      "usd_per_1k_items": 31.5711
    },
    "ollama:gemma3:1b": {
      "n_items": 27,
      "completed": 24,
      "completion_pct": 89.0,
      "depth_on_success_pct": 21.0,
      "schema_valid_pct": 7.0,
      "accuracy_pct": 0.0,
      "goal_pct": 50.0,
      "objectives_pct": 24.0,
      "requirements_pct": 3.0,
      "archetype_fields_pct": 8.0,
      "sec_per_item": 3.6,
      "warm_sec_per_item": 2.4,
      "gen_tok_s": 79.9,
      "usd_per_1k_items": 0.0,
      "wh_per_item": 0.2389
    },
    "ollama:gemma4:31b": {
      "n_items": 27,
      "completed": 25,
      "completion_pct": 93.0,
      "depth_on_success_pct": 90.0,
      "schema_valid_pct": 93.0,
      "accuracy_pct": 68.0,
      "goal_pct": 100.0,
      "objectives_pct": 76.0,
      "requirements_pct": 88.0,
      "archetype_fields_pct": 95.0,
      "sec_per_item": 39.0,
      "warm_sec_per_item": 30.8,
      "gen_tok_s": 14.6,
      "usd_per_1k_items": 0.0,
      "wh_per_item": 2.9121
    },
    "ollama:gpt-oss:20b": {
      "n_items": 27,
      "completed": 23,
      "completion_pct": 85.0,
      "depth_on_success_pct": 78.0,
      "schema_valid_pct": 85.0,
      "accuracy_pct": 57.0,
      "goal_pct": 100.0,
      "objectives_pct": 39.0,
      "requirements_pct": 80.0,
      "archetype_fields_pct": 94.0,
      "sec_per_item": 22.0,
      "warm_sec_per_item": 16.3,
      "gen_tok_s": 21.1,
      "usd_per_1k_items": 0.0,
      "wh_per_item": 1.8564
    },
    "ollama:llama3.1:8b": {
      "n_items": 27,
      "completed": 26,
      "completion_pct": 96.0,
      "depth_on_success_pct": 59.0,
      "schema_valid_pct": 96.0,
      "accuracy_pct": 0.0,
      "goal_pct": 96.0,
      "objectives_pct": 44.0,
      "requirements_pct": 55.0,
      "archetype_fields_pct": 41.0,
      "sec_per_item": 7.3,
      "warm_sec_per_item": 5.3,
      "gen_tok_s": 44.5,
      "usd_per_1k_items": 0.0,
      "wh_per_item": 0.54
    },
    "ollama:qwen2.5-coder:1.5b": {
      "n_items": 27,
      "completed": 25,
      "completion_pct": 93.0,
      "depth_on_success_pct": 67.0,
      "schema_valid_pct": 93.0,
      "accuracy_pct": 0.0,
      "goal_pct": 100.0,
      "objectives_pct": 36.0,
      "requirements_pct": 53.0,
      "archetype_fields_pct": 78.0,
      "sec_per_item": 3.5,
      "warm_sec_per_item": 3.0,
      "gen_tok_s": 120.7,
      "usd_per_1k_items": 0.0,
      "wh_per_item": 0.252
    },
    "ollama:qwen2.5-coder:14b": {
      "n_items": 27,
      "completed": 25,
      "completion_pct": 93.0,
      "depth_on_success_pct": 65.0,
      "schema_valid_pct": 93.0,
      "accuracy_pct": 20.0,
      "goal_pct": 100.0,
      "objectives_pct": 53.0,
      "requirements_pct": 32.0,
      "archetype_fields_pct": 74.0,
      "sec_per_item": 14.1,
      "warm_sec_per_item": 10.2,
      "gen_tok_s": 27.7,
      "usd_per_1k_items": 0.0,
      "wh_per_item": 1.0594
    },
    "ollama:qwen2.5-coder:3b": {
      "n_items": 27,
      "completed": 25,
      "completion_pct": 93.0,
      "depth_on_success_pct": 56.0,
      "schema_valid_pct": 93.0,
      "accuracy_pct": 8.0,
      "goal_pct": 100.0,
      "objectives_pct": 49.0,
      "requirements_pct": 12.0,
      "archetype_fields_pct": 63.0,
      "sec_per_item": 4.5,
      "warm_sec_per_item": 3.6,
      "gen_tok_s": 81.9,
      "usd_per_1k_items": 0.0,
      "wh_per_item": 0.3779
    },
    "ollama:qwen2.5-coder:7b": {
      "n_items": 27,
      "completed": 25,
      "completion_pct": 93.0,
      "depth_on_success_pct": 72.0,
      "schema_valid_pct": 93.0,
      "accuracy_pct": 4.0,
      "goal_pct": 100.0,
      "objectives_pct": 63.0,
      "requirements_pct": 52.0,
      "archetype_fields_pct": 74.0,
      "sec_per_item": 7.6,
      "warm_sec_per_item": 5.7,
      "gen_tok_s": 53.9,
      "usd_per_1k_items": 0.0,
      "wh_per_item": 0.6143
    },
    "ollama:qwen2.5vl:7b": {
      "n_items": 27,
      "completed": 25,
      "completion_pct": 93.0,
      "depth_on_success_pct": 67.0,
      "schema_valid_pct": 93.0,
      "accuracy_pct": 16.0,
      "goal_pct": 100.0,
      "objectives_pct": 49.0,
      "requirements_pct": 68.0,
      "archetype_fields_pct": 52.0,
      "sec_per_item": 7.6,
      "warm_sec_per_item": 5.4,
      "gen_tok_s": 50.4,
      "usd_per_1k_items": 0.0,
      "wh_per_item": 0.5769
    },
    "ollama:qwen3.6:27b": {
      "n_items": 27,
      "completed": 25,
      "completion_pct": 93.0,
      "depth_on_success_pct": 88.0,
      "schema_valid_pct": 93.0,
      "accuracy_pct": 60.0,
      "goal_pct": 100.0,
      "objectives_pct": 68.0,
      "requirements_pct": 97.0,
      "archetype_fields_pct": 88.0,
      "sec_per_item": 29.7,
      "warm_sec_per_item": 22.3,
      "gen_tok_s": 19.8,
      "usd_per_1k_items": 0.0,
      "wh_per_item": 2.3603
    },
    "ollama:qwen3.6:35b": {
      "n_items": 27,
      "completed": 25,
      "completion_pct": 93.0,
      "depth_on_success_pct": 79.0,
      "schema_valid_pct": 93.0,
      "accuracy_pct": 64.0,
      "goal_pct": 100.0,
      "objectives_pct": 56.0,
      "requirements_pct": 69.0,
      "archetype_fields_pct": 92.0,
      "sec_per_item": 20.3,
      "warm_sec_per_item": 10.8,
      "gen_tok_s": 27.3,
      "usd_per_1k_items": 0.0,
      "wh_per_item": 1.0862
    },
    "ollama:qwen3:8b": {
      "n_items": 27,
      "completed": 25,
      "completion_pct": 93.0,
      "depth_on_success_pct": 85.0,
      "schema_valid_pct": 93.0,
      "accuracy_pct": 16.0,
      "goal_pct": 100.0,
      "objectives_pct": 61.0,
      "requirements_pct": 85.0,
      "archetype_fields_pct": 93.0,
      "sec_per_item": 8.8,
      "warm_sec_per_item": 6.8,
      "gen_tok_s": 49.7,
      "usd_per_1k_items": 0.0,
      "wh_per_item": 0.6961
    }
  }
}
